{
  "id": "MAT-DEMO-001",
  "schema_version": "0.2.0",
  "status": "draft",
  "parent_capture_id": null,
  "capture": {
    "text_original": "然而，当我们重新回归到对奋斗最原始的思考，我们会发现，或许诚如我上文论述所说，我们个体的单独奋斗很难改变世界，但这不应该是我们选择沉沦自己对改变世界的想法的原因，而启示我们，倘若我们在意识到改变世界的困难并仍有勇气奋斗下去，即使成功微乎其微，即使失败无可避免，即使“我”的奋斗无法改变世界，我们在确立目标并为之奋斗的过程中，又何尝不是在倔强地不让世界改变我们呢？但这一次，或许我们的奋斗就能吸引到和我们志同道合，同样希望改变世界的“他们“加入我们为之奋斗，就能让更多更多希望改变世界的人为之奋斗，乃至最终，千千万万个我们汇成一个群体，用群体的力量突破个人的局限，形成一个撬动世界的支点？",
    "context_before": null,
    "context_after": null,
    "source": {
      "title": "作文合订本（附注中的写作片段）",
      "author": null,
      "edition": null,
      "url": null,
      "file_sha256": "f91a8d8f4e93dfb804ce95d544ed9fefc4ea85c93b6c30cbb1492a770fef539f",
      "locator": {
        "kind": "docx_paragraph",
        "value": "119",
        "asset_path": "sources/作文合订本.docx"
      }
    },
    "highlight": {
      "color_raw": null,
      "color_normalized": "unknown",
      "capture_type": "unknown"
    },
    "extraction_method": "docx_text",
    "context_note": "附件中置于“25二模 / ⭐浦东 奋斗的目的”题干之后；片段提到“上文论述”，但完整文章未提供。"
  },
  "reader_note": null,
  "analysis": {
    "paraphrase": "这段论述把奋斗对世界的影响、对自身信念的保持，以及争取他人协作连在一起，尝试回应改变世界与不被世界改变的二选一。",
    "primary_theme": "T02",
    "secondary_themes": [
      "T01",
      "T05"
    ],
    "classification_reason": "核心是个体行动在现实限制中的作用；同时涉及身份维持，以及通过群体协作扩大影响的设想。",
    "concept_candidates": [],
    "argument_uses": [
      {
        "claim": "改变外部世界与维持内在信念，可以是同一奋斗过程的两个维度。",
        "relation": "supports",
        "role": "synthesis",
        "reasoning": "片段提出，追求外在目标的过程也可能维持主体信念，因此两个目的并非必然相斥。这是一项可展开的论证思路，并非已被经验验证的结论。",
        "conditions": [
          "目标与行动确实体现经反思的信念",
          "允许根据现实反馈修正方法"
        ],
        "limits": [
          "不能推出所有坚持都是正确的",
          "不能保证保持信念就一定改变世界"
        ],
        "evidence_status": "interpretive"
      },
      {
        "claim": "个体当前的能力边界可能通过协作扩展。",
        "relation": "supports",
        "role": "mechanism",
        "reasoning": "片段提出从吸引同道到群体协作的可能路径，但没有提供实际案例来验证各环节。",
        "conditions": [
          "共同目标可协调",
          "存在组织、资源和行动条件"
        ],
        "limits": [
          "不能保证坚持必然吸引他人",
          "人数增加不自动形成有效协作"
        ],
        "evidence_status": "needs_fact_check"
      }
    ],
    "related_prompts": [
      {
        "id": "PR-0030",
        "reason": "片段直接回应奋斗是改变世界还是不被改变，可用来讨论二者相互联系。"
      },
      {
        "id": "PR-0038",
        "reason": "把个体局限与协作条件分开，有助讨论哪些局限可以改变，但需要补充实际证据。"
      },
      {
        "id": "PR-0068",
        "reason": "提供改变自我和改变世界可能相互促进的方向，不能据此忽略外部条件。"
      }
    ],
    "open_questions": [
      "片段作者与完整文章是什么？",
      "有哪些可靠案例能说明协作扩大行动范围，又有哪些失败情形？",
      "保持信念与顽固拒绝修正应如何区分？"
    ]
  },
  "review_notes": [
    "仅核对摘录与附件段落119一致；没有核实作者身份。",
    "本例直接提取普通 DOCX 正文，不是颜色识别结果；未给它伪造原始颜色。",
    "未提供读者留言，因此 reader_note 为 null。"
  ],
  "reviewed_by": null,
  "reviewed_at": null,
  "source_match": {
    "status": "matched",
    "basis": "与附件 DOCX 正文段落119逐字比对一致；只核对转录，不核验片段内事实。",
    "checked_by": "Codex",
    "checked_at": "2026-09-08"
  }
}
